{
  "mock": true,
  "profile": "snp",
  "evidence": {
    "type": "SNP Evidence",
    "evidence": "YVZ3Of+EHqFFAzI4tKZXPe1wlcNBV7xnlqwAmIajL3HAWsdznnGkwkUHHjSX3WrjDCP2HkBxrJ79cxkFcZaCp/q5zq++keNP1/qcCToiIqtARm0vYfKNwps4/JAEZhqIwTx8CBFwN1+ATcqhowIZNyHLwle2X6M9vP4axIt7jl3uW3gc74O/UI9Q6Kcrw4KfLWaz4fCCMC0oO0BKhcPt+SyuzwrF/NgXMB6SGxwpwrjkh4mlvOnsxFhj3YhfBABJUE30Ufc3LTNT5KtrxvMF2Jfp8564fY0wthZ7r38yb605aFyjzdxJhHanrIaxFPFiWMiL8tUmhq72q6VsZMLEVCg6bc7beheqroS2qcJov70z+bW76y3dkMl5MesMpPE6MinMOf61psMu4x46ddhk4jrfCJgOZpLXqlfB24fda/fioeChBwrecB+y1uHkVRtCnq405fqQx1NEZ+/gu/5UZDHneLEMPMP1Lt3+11ZlMemuPFDE3CrCRUlPOsQB5oYw2M95Fs9XruB663uUswWFOgBwBaHqudPfBjcMVVHvUJpaEYcQB0HJPXUxck+1hyFT3MDYGMl60sTbH9/NlBSRCTTb3V70vrrRkv1qqa4Zh2AqMIfOzVzCzdzFSbdL9p0W0oczUWgR2Au9SXH1i2MeQKT2ROjrGxGCo972eizpsfEYDflLWkdJD2ze4B8/IpvThszp6ViC8aFcrr8mPLegQJ6zcbSR13sB6UNZIdpfgTMrQEisV8YutSTDLb/c7/y+t5RdJWVOgIdlfEXcHO2e9ZhPaWdv78fGdgNuGmINx8UVeaJhY4qzdkgDX78SO+7Qs83/1flQimSZ0tPBiUtX6EuTIW1blum0tV7FCmWCuRX82Nvb6zuhkpSsk8t1uwpPN0FI8RyWIlZ/5BhU+joNMwEqufdtLi/NfQQ/Iis2ooxdB+TMPjgfl1Y/zbVBUEaufwhd3IVTCpJ0SUwU0lfiSRl72BeY9qMP5Iqt/ZUcaY6Sm5PIIxf05U6u3oxzvM4al7s7P/Tf7mQ0gpVnu+I4nS/Cs0J0nm0vTYTdesJXgIs8gGcw5BB5zA4BW2ENydrK/s0+rxd24s4oWF76I8c92MWuu4ieGCpZFEUiRjC960rE27XCAF7Y8+oqRKvPmj6ULA7WE8xOvYEmXZF7FXvQ6I6bq4/Nk5mruIzcppQRgxIIvGc3CJ0ZeFoU/51BuiygrcqYYnI8csMkX9DlnlQ399cvy2PREAG2iGiKllLiYstNOT4BXF7ifINw/j5rIzfL35vci8unRUcWTAiaj0o5pYWmdXJtv8fQfp9JmUUFUQc2LNhHR9ez4bUrcsIHj67gZizURXXGVz+Qar5tfKp1QSK95TFDtGcFAA2ilNybsgonq3KDO6H7Kr5Knvn5Ae7fekPtXa0jS1jzQs/kvJz/aKMX1qbtHh6q4HLxLFk8flavj/OM6uqzjIm6dIPcC2mMaHmx+sWJaBuAAq3iDNcsiJE4tm5FeZjyOCIh0VQW13L24EkS1ENAH7Gt9N1lZfb1eHUhdamKZfPKNNADCusBB2bvcfSACh07EFebF8MCycg="
  },
  "collateral": {
    "type": "SNP Evidence",
    "certs": [
      "XzTKN66nEJDC66WtNfUA3GdyyuAff7dtAcxYSZIP8K3KwhyNeAUqWaLROa6n/+3LJl8ILwAKJCTi+ZLpyul2xYBhChGs4S7PuTOlouH29AmgfY6ZRVmsmZ6pLC+8yRUzwMLbE69s3sJ7x11HWgvie82Zz071U5+36aPGcCnn28ScSQlgkEAW78ARWrXoZjFs2XLZDGQPTIP9Pmi8niXyYBrZ7FTxuA2e4GXAmPRwoV1bSJqrfc/egSy7uEOGaMpZtsgujd2KRETyoiDHKcsmAMbOPUFsfAnsKij0uunZ5DxY5wTj/k4kOq2zHhBtuGbz3j4RwcTXXSaFkkC7/jwfoD9Lz/yRmZ098cNDskUKK/q75vgCFJ+9DKf72RdkH8eliVtFawC6zUbknD0zowtkbbp9zPT6egi1tIswXWbsouyWmTfnNrLCsr91+2N6+NljakU+ClwtZscJ3ZEDfsu/4Ga5LbQ5GjtC5wI2n244HPZdRyNPiIMQedUfFrCqaoSIdVDSvlY8GGCxo38w9RZUSmdLAdy0bYn8m5q26bv84iE+7LM2DwcnkNP8sZmtI9Q4vOoGhV/5LL0Fy3RIrPin7FRdMcgG2u8etUNEL9yi7ldL7gebE1IGkCF9EY+NPFjB3qsILW7ddU9hK2x7+wl97Wu18Q0KsqWLvrb1D428Cok=",
      "BPhEoc39XQGQX5VpSuGPCD6hSzvWWxfy5V2EJijBoj5kmowGYt7oNQfkBoBO3mcvnkPkyhEcYMSLsgTEw5UD+DIWRt1LJA3LDAdR4R/1YTq7pvPrgZjHf8+QhlEieYaifeBWoiJ2p/lQpT4bFVq71K6EvmFh251Ss8k4aQZGHbHLo+XnZ2oklTBRp6JqrLFMEvPD2B+csbLWlY6fc+C+6A+bNjNRYD5BLmqZjNwPS3iAvikrCa6buF4lW5Oe7fCy+aQlGuwETbg1TTBUPNnLdtpD4NcAWC+/rbOPJ7mpRYpTJ0jg4ffMcXWY+zBmNvWxYZT3PrxZgpmBs/cECrzhJlgVT+ol9mOerYmhVdFJYdBsGm+FnP1PZc4e9kKTmHZ3RcGAwsSTdct6VEab913gGTdGuCHDqNCIYTc/IBdsyF7GNNC+f5Io5EEq8ueJXErAIIPUQWNBD8LQ82pCADs8j9UcXjPzMyz5AVOts32+CZPQac4ILkk7mTERrfA1lvsiPs6wlrM+XcvhM8P6Ep3d5xOLNAu+ImBvkdU1StkKJg5xibncfy1Ssewdhtr+YTVlqBpeeOGQrGOyZ6/stHBs4ItAwDR4a457QFqSxJjEySpyFkHOM/wtZqpZpwe2PzURfm+vgLSnjUSZjOHk0DDhxRHrCBR+S/6XT1hBp8ZZgFM=",
      "GuvAwSVUQi7uw7Du303q7aqzbEVJn7Nta3eiKaB1BjxTof+o9qz2zXebrnpEAT3k1VG282SLdGppPA1CigC6KG04o5FDilHhQQGVFa88vJwqGhoCt2YHuJUpuzxiVtOZCRyvHacvyYZnlavFNEyHx9o5Jc8Ig6lOogeO0IUUDX+52cgqDs6FLblUoJeB8O25PaNiZ2VR/vmSs9tKNd1QDqIpLvd8yir0qCX/eBVNe0bXBYn2+T2WgMh7BGMpQ3P+kRybhaxRs9GV/1fbi1gj7E0oqEA48zdrhwEwStFe359irhKyWUkesqBXdHQq/qLDmEGjjeUm96uYGVQNvNisOv2wrxz2lYdUoRyI0sZTnXY/V6HS0r5KVBuvaRywLnUfGKH+8/I2+PythRuQVraX7kFc3pWbIx4PwWrcpY63FG21dF0SKxF4D1vMWDGo44MRARclmXjwgoKoU2L+NvJt5vNCO/k1fQDYe7T/l/rTZ93TJfSC/5bjRupmTa+Qh12HY/nauVCHrgPXmaX9pLf8i6ymPyrUKW0KgLScmbo6H1oAOkOMbrpCMgyLkz96kvXX4OX+epD2kAP38tdm91ByRcLFD/7oAQ1L0biuFYktJHFhrce3zqF1smUIYEGywoXmb1Yg3YiJstonEwq4qpp+lk6YnqbiV/jNRNBwwV3kyHI="
    ]
  }
}