{
  "mock": true,
  "profile": "azure-snp",
  "evidence": {
    "type": "azure SNP Evidence",
    "evidence": "9ajutNlVKTAXcbpHKVegrInrG0vHGmXBMo59nhm29gmQJykS0OaHoggJwpncZtA14GOfczW28sVFpvJH583VaSlQPUs6g2V65dc24dE/NYCd0Zqm2PC8HW3AMiPGyoaBQfaHWRS5lXPOtfvwRs/GZ4PAHv8oUTUACrLx7zBg6V2dSV930CevR0XN4VQs5+43wvOGlplzQ2877BRpzjZY3K0ANfJ3+wxMVkU9eWLiNzUxCO6hWFbE0y0OaUEyTd1VaIVvwZStljOENgcvjLfgnKYXnpdCsUSBK6pYNB56tIvov52ck696szd3NTfT9FosFzcmCFwIj3X3wU0TARYnXcrwzwuecwp4c+fpVT4x6J7erhs1op9stel2CXpFuVueWhMgR1ilgjLMoXvUQ+Q0Alc47cj3miWzYHpTproPujU4TsRV0vbk52xKLtO878wES7JoyCf1Qilo7IL3VJfzsk5Ax/AWASgDJE1EJ9TKUUkla8kVk4UnIiGZViMd9ASyz+i8+6Aqy+xbY/XapjPeU7ibPINcJlRnYipcKxjvu4Xae9otf1VceAzVmoQKJsnBH24e7vx0C9MPjdmVtdEouEaBh63XdTnORgmC/zq2J9+/HohmJBs7cCGjGNcFi6ngSNa1aH+hkE4VTHlLxte1hZZQ0jK6jz85n5Q+DtlU8Q5ycGd4Mgi5aY7/nAZy5Y5VTDSmXaOY5E+Kg8utzY654MLiF90p6NYWaV/ClmojyfjVWcJ2Hwhmz432+OyE9v1ktIl2MXHHxtFIb/bvacJ56rkeREQQ8vYo3GDPNcbREbc97hJ1ODB2mstit3XoTMO66l6K5QKW1gQpl+4LjNmPYxvyi75+cY57YY5Hx6qhtY1FC2wlkChfaOfebzku5VnP4tBCh63vZERyvCa84+dWsPGQxEQrvYl40ATfABEXECykQOkNWnjxOjiwWFNznsfV799N+5h6JNawqM10DwRX8hv3WixQdGIyYt1aAAjPtcUwRED6qET/FASo8mTnjaIK0DHhKAqUDl4WVtJ0Q4XM8q8YEqfUT83yRv9QFD8AU2DcdXOl1T/5CUbJom8Eo6ZcyjYkwskGL+Sf6L2J6TMPniinVO/QHd2kkQJMn7QQl2+ESNZrX0jOzMnVPAquNAhXWhwOhpOxWEYDyjri+kDmery5SbJ2tzzNYeugXDAhuterf8mB7kh1qiKPLEaTsprxylaxr4fY2zKeWaRsRMyRfLxpy7hXXjMymYG1Mci3o8zUX2l9sWtnYmCGRJXYWkR//pIayWe+7mEyDP3giPiN/F82MAZmVgZZthRm9s4ile6v6Ql5eDWGQkRkKwVcgKwscGRYRm+FP/oO15CDWMQxxzXUHqdz9dAHyJ9yTpcgF3WmfeQ9Ive7m2zCPdAzEX7LVj/zktwWqZiqiFB9D18tIUZLoZek5HKTPDPdqRG8xUFPPxlogVim9FJ0o572AEXbZCL3vkDmrRcjBnBKpjdvsj+o6HwUhA3oGDSFf/JcOVJDzZHqn6q+do7Ygf8Jlld+aXHRqmDoAMenA+m5FetTBBYwlBUyZvpk+VwvNGqqUvI="
  },
  "collateral": {
    "type": "azure SNP Evidence",
    "certs": [
      "ZjaW4OV2mej4NA/zqzzLXHfggalrNZL1lXdvH/cngj5JPP8e3fpn7Tnt0Ur5pvTtdw5aawfKPdiXbNn4zARhpm3MD3VCqET6h9jNzaaHWmCF3ZnduaFzn1z2ZnQG6H4R+dQuhtqlSSEkfhwzxFUdK7n7fCmyB46YyuHzUPN62qIlZdBkswcDESdbBFNLJhsoUOfDttKbksygMnPZkSg+4w5GzaTnpVG9vxbQOFP96a3vXc+N5hTumytS1P1KO6v0uUxJp4/P/66uvP6S2l8IYPYRh7BDV0BSOZEYjIoyXv/a7hfQkLIIM3V5boTiD1RbbLtqOYx3EpxM3RDcfc7lHbN5QaHecj/li9jvE4eux3WnWafeGter22+UsvPrLAgcybuPCLaVFxbTDHSvec0dnzjzwQIN3Fe6hOrSrVFHB2zcPE6CT/xGGffE8pXZN2RvUYFLr5NFFo+ii0qtJ7EOBNELu+FvkBZzeZXAIv9mrFSF+k0Yxs+XhQpRa7yzWxntDquDnf+nddlVX4Yn/bAGtLGjifSQwXNIdC7CFkKrpMB7cPLM/JumjcRWjuAn6EvG/XOgHGBIGVWKGo4xZfVSmp2qrQqs7Gu/s1/zHlyKYhOCpQPXiVj3qqzebVfkIjCP00FH4AYwtS5/7s7Zf0uuQnL4oYVv/a/0oRR59PXVdyI=",
      "JZFezMitAYDsH5vgi68CGOZjfuonXHptxS54iAcvy2OHwygGU3ib79c3PgJcPs2XLkM1+l5hyCBfltRBgWcabL3A7Rj1LhDwP2a/JC+7bfq/hO0+HXkTxpmV5WqOCBsL/RePkK+BJkdR7E+ImpRxt333r9x5lFLaNEa1hcbFVpCQwqiA4Ls4R6DaeaiAHxvMIV4ny7sIq6zvNZTj1+Jlns1e+XdvCvyMcudgTU3Cj81/vsFFW9VGZfupWep1eNPgXEkpF7v9k3+jMAvkU4pJJELW0vIVDKcHGZ14NtpeS9Ysd/mIVyEUV+UGAiq0g3hKd4qaV/hnrdOROsO+NQmBUTrZPZ5K1VeT5RnpTl4JLjbUceLFH/8bumoRQi6yb+qJg15l0mWlf9KEZ79275uhEcjeFGPIfXqJhtPbNFGom91D9uocp1xnknSdjKurcT9uW3mxLsqQZzx/olPLILXi1q5T0WgQh28rb1VeOByYpMEgbamuKfK9GfvOjoyUGZHQOVyLmrds7xuiXuv7vt8VgW/lVbNpGC2cukUHF2jJFYl/j1/fVc73ZgrLsnk27HaQ0WJ4kc9vO/Aa8LpHeTJZAhsk8qS7nB5yi8Ppx+sWjlEbhbYCiUGMfQSOgK3xskIB+qPvn0tLMkr96GEqX+aDackt4kynbAlK7XuA3JIvYFU=",
      "wwYoW2pza/Dd+bMa865I96yOkJjEMhuSONqrWoL+OPmVdVhAp/FBHlDaO8wwYk2MyCiw/M1kciMitYJTBqypMPjqzRkphCFj4ZCLSIv6gmUf83gls8r0p1Rj+m8j3uVmqV1X2kk/9xHNIFXi8QJsmz86hLe2yL3VX6/Y8xRnF6kc648ot9eXSIo01FxsmH5xAEBf+9GngKmbb/3vGLLshOyaeT90XAgYO19jmydgY+5p+svGGLkymZ97E+jaeULoJz1kHrwUX6L7T/GFV+L08MnPBnLmziBaeGze+VfeHeAfEb463K/7Hnyzfz79kER070Mus35ewmiLMaexa3KOTdE7dTOCZhj5Kq2aTj2W1ejjr1syvo8A62q49hKoe3ImA0JJay9zDKg0rEuKT1eR2MHGLiGwwt8FlTNxkB5OZKgyJmdDe3A6H6YxLm3WckiOewWfKcpPuss9gwiVkXzNNw2jR09LG6MVV/IBtnV5dv3+xtAFZUV9CnOa5YTmn64Dqof6rraer2zfg95/QM9399GeApbVpjm8a+AahEv3z4lrtCAjSGL7vVKwGdx+RzuC13PWFAYtA3FcDjFv3+ygSihYaQtvpVTGemH4q+h/jv7gklAaDFg6mQuKTMCTm1wH1Qdexy1pI2TeNtTpQ9B93meDnQT7aJ9cVhA8VBZKfR4="
    ]
  }
}